{
  "policyKind": "loss_accounting",
  "version": 1,
  "effectiveFrom": "1970-01-01T00:00:00Z",
  "effectiveTo": null,
  "scope": { "tenantId": "00000000-0000-0000-0000-000000000000", "siteId": null, "unitId": null },
  "notes": "Seed default recorded 2026-10-27: computed loss accounting per shift, the plan as target (declared mode is opt-in). scope.tenantId is a placeholder that the seeder replaces with the real tenant id.",
  "body": {
    "grain": "shift",
    "dayStart": "06:00",
    "lossBasis": "computed",
    "targetSource": "plan",
    "accountingUnitId": null,
    "stopsCrossCheck": true,
    "identityTolerance": 0
  }
}
